{
  "$schema": "https://json-schema.org/draft/2020-12/schema",
  "type": "object",
  "properties": {
    "site": {
      "type": "object",
      "properties": {
        "name": {
          "type": "string"
        },
        "timeZone": {
          "type": "string"
        }
      },
      "required": ["name", "timeZone"],
      "additionalProperties": false
    },
    "epoch": {
      "anyOf": [
        {
          "type": "integer",
          "minimum": 1,
          "maximum": 9007199254740991
        },
        {
          "type": "null"
        }
      ]
    },
    "sportpass": {
      "type": "object",
      "properties": {
        "salt": {
          "type": "string",
          "pattern": "^[0-9a-f]{32}$"
        },
        "hashes": {
          "maxItems": 100000,
          "type": "array",
          "items": {
            "type": "string",
            "pattern": "^[0-9a-f]{64}$"
          }
        }
      },
      "required": ["salt", "hashes"],
      "additionalProperties": false
    },
    "blocked": {
      "maxItems": 100000,
      "type": "array",
      "items": {
        "type": "object",
        "properties": {
          "scheibenId": {
            "type": "integer",
            "minimum": -2147483648,
            "maximum": 2147483647
          },
          "startedAt": {
            "type": "string",
            "format": "date-time",
            "pattern": "^(?:(?:\\d\\d[2468][048]|\\d\\d[13579][26]|\\d\\d0[48]|[02468][048]00|[13579][26]00)-02-29|\\d{4}-(?:(?:0[13578]|1[02])-(?:0[1-9]|[12]\\d|3[01])|(?:0[469]|11)-(?:0[1-9]|[12]\\d|30)|(?:02)-(?:0[1-9]|1\\d|2[0-8])))T(?:(?:[01]\\d|2[0-3]):[0-5]\\d:[0-5]\\d\\.\\d{3}(?:Z))$"
          },
          "epoch": {
            "type": "integer",
            "minimum": 1,
            "maximum": 9007199254740991
          }
        },
        "required": ["scheibenId", "startedAt"],
        "additionalProperties": false
      }
    },
    "watermark": {
      "anyOf": [
        {
          "type": "string",
          "format": "date-time",
          "pattern": "^(?:(?:\\d\\d[2468][048]|\\d\\d[13579][26]|\\d\\d0[48]|[02468][048]00|[13579][26]00)-02-29|\\d{4}-(?:(?:0[13578]|1[02])-(?:0[1-9]|[12]\\d|3[01])|(?:0[469]|11)-(?:0[1-9]|[12]\\d|30)|(?:02)-(?:0[1-9]|1\\d|2[0-8])))T(?:(?:[01]\\d|2[0-3]):[0-5]\\d:[0-5]\\d\\.\\d{3}(?:Z))$"
        },
        {
          "type": "null"
        }
      ]
    },
    "history": {
      "maxItems": 1000,
      "type": "array",
      "items": {
        "type": "object",
        "properties": {
          "id": {
            "type": "integer",
            "minimum": 1,
            "maximum": 9007199254740991
          },
          "since": {
            "type": "string",
            "format": "date-time",
            "pattern": "^(?:(?:\\d\\d[2468][048]|\\d\\d[13579][26]|\\d\\d0[48]|[02468][048]00|[13579][26]00)-02-29|\\d{4}-(?:(?:0[13578]|1[02])-(?:0[1-9]|[12]\\d|3[01])|(?:0[469]|11)-(?:0[1-9]|[12]\\d|30)|(?:02)-(?:0[1-9]|1\\d|2[0-8])))T(?:(?:[01]\\d|2[0-3]):[0-5]\\d:[0-5]\\d\\.\\d{3}(?:Z))$"
          },
          "sportpassHash": {
            "type": "string",
            "pattern": "^[0-9a-f]{64}$"
          }
        },
        "required": ["id", "since", "sportpassHash"],
        "additionalProperties": false
      }
    },
    "requests": {
      "maxItems": 1000,
      "type": "array",
      "items": {
        "type": "object",
        "properties": {
          "id": {
            "type": "integer",
            "minimum": 1,
            "maximum": 9007199254740991
          },
          "scheibenId": {
            "type": "integer",
            "minimum": -2147483648,
            "maximum": 2147483647
          }
        },
        "required": ["id", "scheibenId"],
        "additionalProperties": false
      }
    }
  },
  "required": ["site", "epoch", "sportpass", "blocked", "watermark"],
  "additionalProperties": false,
  "title": "Spiegel-Zustand der Brücke v1"
}
