{
  "site": { "name": "SV Musterstadt", "timeZone": "Europe/Berlin" },
  "epoch": 1,
  "sportpass": {
    "salt": "0f1e2d3c4b5a69788796a5b4c3d2e1f0",
    "hashes": ["f80f0364b1fe2c184903848cd481e81e69a4b60e5fbb44f51cc78371525f6168"]
  },
  "blocked": [{ "scheibenId": -7257056, "startedAt": "2026-10-09T17:20:41.381Z" }],
  "watermark": "2026-10-09T20:04:11.520Z"
}
